{
  "schema_version": "temporary-ux-ui-standards-guidance.v1",
  "guidance_id": "UXUI-GUIDANCE-RESPONSIVE-SPACING",
  "revision": "r001",
  "lifecycle": {
    "status": "active",
    "issued_at": "2026-07-24",
    "review_by": "2026-10-24",
    "supersedes": null,
    "superseded_by": null
  },
  "guidance_items": [
    {
      "item_id": "UXUI-SPACING-001",
      "statement": "Prefer a documented spacing scale when no higher-authority project rule conflicts.",
      "strength": "recommended",
      "provenance": {
        "source_title": "EV4 temporary UX/UI standards policy",
        "source_owner": "EV4 repository owner",
        "source_url": "https://github.com/rezahh107/EV4-Responsive-Architect",
        "source_class": "approved_internal_policy",
        "retrieved_at": "2026-07-24",
        "version_scope": "r001"
      },
      "applicability": {
        "applies_when": ["No repository contract or project-specific evidence defines a conflicting spacing rule."],
        "does_not_apply_when": ["A higher-authority contract, Kernel decision, Project Gate boundary, or gated project evidence conflicts."],
        "surfaces": ["responsive layout spacing decisions"]
      },
      "exceptions": ["Documented content, accessibility, localization, or viewport constraints may require a bounded exception."],
      "conflicts": [],
      "universal_rule_claimed": false
    }
  ],
  "conflict_handling": {
    "precedence": [
      "repository_contracts_schemas_validators_stage_anchors",
      "kernel_decisions_and_project_gate_boundaries",
      "gated_project_specific_evidence",
      "temporary_ux_ui_guidance"
    ],
    "unresolved_conflict_effect": "fail_closed_non_selectable",
    "guidance_may_override_higher_authority": false
  },
  "authority_boundary": {
    "usage_class": "non_authoritative_decision_support",
    "repository_authority_created": false,
    "replaces_contracts_or_validators": false,
    "replaces_stage_anchors": false,
    "replaces_kernel_decisions": false,
    "replaces_project_gate_authority": false,
    "creates_project_specific_evidence": false,
    "may_establish_correctness": false
  },
  "boundary_claims": {
    "submitted_evidence_created": false,
    "issue_8_mutated": false,
    "pilot_authorized": false,
    "release_ready": false,
    "live_render_validated": false,
    "export_json_validated": false,
    "accessibility_passed": false,
    "pixel_perfect": false,
    "responsive_correctness_validated": false
  }
}